{
  "slug": "wedding",
  "status": "placeholder",
  "faReview": "needed",
  "family": "CELEBRATION",
  "experienceMode": "CELEBRATION",
  "name": { "en": "Weddings", "fa": "عروسی" },
  "summary": {
    "en": "PLACEHOLDER – Your whole wedding, from the first idea to the last dance.",
    "fa": "PLACEHOLDER – عروسی شما، از نخستین ایده تا آخرین رقص."
  },
  "includes": [
    "planning",
    "venue",
    "styling",
    "florals",
    "catering",
    "cake-sweets",
    "photo-video",
    "entertainment",
    "hire",
    "invitations",
    "staffing"
  ]
}
